{
  "version": "1.0.0",
  "mode": "live",
  "endpoint": "http://127.0.0.1:11434",
  "model": "qwen3:4b",
  "responses_file": null,
  "reviewer": false,
  "num_ctx": 8192,
  "min_available_memory_mib": 1536,
  "data_approval": {
    "approved": false,
    "data_classes": [
      "synthetic"
    ],
    "capture_sha256": [],
    "declaration": "Set explicit approved capture SHA-256 values before a local live run."
  },
  "budgets": {
    "max_calls": 6,
    "max_tool_calls": 16,
    "max_input_token_charge": 300000,
    "max_output_tokens_per_call": 2048,
    "max_output_tokens_total": 12288,
    "max_response_bytes": 131072,
    "max_recording_bytes": 8388608,
    "max_inspected_characters": 40000,
    "max_wall_seconds": 600,
    "max_retries": 0,
    "max_repairs": 2,
    "max_input_tokens_total": 49152
  },
  "response_format": "json",
  "provider_location": "workstation",
  "tunnel_declaration": null
}
